<?xml version="1.0" encoding="ISO-8859-1"?>
<?xml-stylesheet type="text/xsl" href="../../../xsl/Account2xml.xsl"?>
<!DOCTYPE Account SYSTEM "../../../dtd/Account.dtd">
<Account>
  <name>AXA-Autoverzekering</name>
  <action id="16">
    <nr>DIV16</nr>
    <journal>Diversen</journal>
    <date>4/1/2013</date>
    <debit>25.93</debit>
    <description>Verzekeringen januari</description>
  </action>
  <action id="69">
    <nr>DIV69</nr>
    <journal>Diversen</journal>
    <date>6/2/2013</date>
    <debit>25.93</debit>
    <description>verzekeringen + Sophia</description>
  </action>
</Account>